{
  "schema_version": 1,
  "index_id": "CURRENT_TEST_VEHICLE_EVIDENCE",
  "example_only": false,
  "entries": [
    {
      "evidence_id": "CURRENT_TEST_VEHICLE_TOOL32_CAS_KLEMMENSTATUS_2026_08_09",
      "kind": "MANUAL_NOTE",
      "relative_path": "current-test-vehicle-tool32-cas-klemmenstatus-2026-08-09.manual-note.txt",
      "captured_at": "2026-08-09T18:11:02+02:00",
      "tool_name": "Tool32",
      "tool_version": null,
      "sha256": null,
      "contains_personal_data": false,
      "description": "Manual transcription of repeated CAS.PRG status_fzg_zustand KLEMMENSTATUS observations."
    },
    {
      "evidence_id": "CURRENT_TEST_VEHICLE_PHASE3D_IDENTIFICATION_STATUS_2026_08_09",
      "kind": "MANUAL_NOTE",
      "relative_path": "current-test-vehicle-phase3d-identification-and-status-2026-08-09.manual-note.txt",
      "captured_at": "2026-08-09T18:39:03+02:00",
      "tool_name": null,
      "tool_version": null,
      "sha256": null,
      "contains_personal_data": false,
      "description": "Manual transcription of real ISTA and Tool32 identification and status observations supplied for Phase 3D."
    },
    {
      "evidence_id": "CURRENT_TEST_VEHICLE_PHASE3D_TESTO_OEM_START_2026_08_09",
      "kind": "MANUAL_NOTE",
      "relative_path": "current-test-vehicle-phase3d-testo-oem-start-2026-08-09.manual-note.txt",
      "captured_at": "2026-08-09T18:39:03+02:00",
      "tool_name": "TestO",
      "tool_version": null,
      "sha256": null,
      "contains_personal_data": false,
      "description": "Manual transcription of the ordered RPM sequence; raw TestO CSV and source timestamps are not yet available."
    },
    {
      "evidence_id": "CURRENT_TEST_VEHICLE_PHASE3D_SYNCHRONIZED_MSA_FOLLOWUP_2026_08_09",
      "kind": "MANUAL_NOTE",
      "relative_path": "current-test-vehicle-phase3d-synchronized-msa-followup-2026-08-09.manual-note.txt",
      "captured_at": "2026-08-09T19:03:01+02:00",
      "tool_name": null,
      "tool_version": null,
      "sha256": null,
      "contains_personal_data": false,
      "description": "Manual transcription of repeated EGS/CAS/DDE observations and the synchronized RPM plus STATUS_MSA OEM-start timeline."
    },
    {
      "evidence_id": "CURRENT_TEST_VEHICLE_PHASE3D_CAS_KL50_2026_08_09",
      "kind": "MANUAL_NOTE",
      "relative_path": "current-test-vehicle-phase3d-cas-kl50-2026-08-09.manual-note.txt",
      "captured_at": "2026-08-09T19:17:46+02:00",
      "tool_name": "Tool32",
      "tool_version": null,
      "sha256": null,
      "contains_personal_data": false,
      "description": "Manual transcription of CAS.PRG status_fzg_zustand Job-Info and the observed KLEMMENSTATUS 69/85/69 KL50 sequence during one OEM start."
    },
    {
      "evidence_id": "CURRENT_TEST_VEHICLE_PHASE3D_CAS_KL50_IFH_LEVEL1_2026_08_09",
      "kind": "MANUAL_NOTE",
      "relative_path": "current-test-vehicle-phase3d-cas-kl50-ifh-level1-2026-08-09.manual-note.txt",
      "captured_at": "2026-08-09T19:27:26+02:00",
      "tool_name": "EDIABAS IFH Trace",
      "tool_version": null,
      "sha256": null,
      "contains_personal_data": false,
      "description": "Manual transcription of a real IFH Trace Level 1 corroborating repeated KLEMMENSTATUS 85 followed by 69; raw ifh.trc is not stored in the repository."
    },
    {
      "evidence_id": "CURRENT_TEST_VEHICLE_PHASE3D_CAS_KL50_IFH_LEVEL3_2026_08_09",
      "kind": "MANUAL_NOTE",
      "relative_path": "current-test-vehicle-phase3d-cas-kl50-ifh-level3-2026-08-09.manual-note.txt",
      "captured_at": "2026-08-09T20:47:20.578+02:00",
      "tool_name": "EDIABAS IFH Trace",
      "tool_version": null,
      "sha256": null,
      "contains_personal_data": false,
      "description": "Manual transcription of a real IFH Trace Level 3 bounding KL50 ON between 720 and 827 ms from timestamped samples; raw ifh.trc is not stored in the repository."
    },
    {
      "evidence_id": "CURRENT_TEST_VEHICLE_PHASE3D_TESTO2_CAS_DDE_CORRELATION_2026_08_09",
      "kind": "MANUAL_NOTE",
      "relative_path": "current-test-vehicle-phase3d-testo2-cas-dde-correlation-2026-08-09.raw-excerpt.txt",
      "captured_at": "2026-08-09T21:21:16.895+02:00",
      "tool_name": "TestO 2.0",
      "tool_version": "2.0",
      "sha256": null,
      "contains_personal_data": false,
      "description": "Critical raw excerpt and recovery metadata from one read-only TestO process/session polling CAS then DDE with Date.now() timestamps."
    },
    {
      "evidence_id": "CURRENT_TEST_VEHICLE_PHASE3D_TESTO2_CAS_DDE_FULL_CYCLE_2026_08_09",
      "kind": "MANUAL_NOTE",
      "relative_path": "current-test-vehicle-phase3d-testo2-full-cycle-2026-08-09.raw-excerpt.txt",
      "captured_at": "2026-08-09T21:29:43+02:00",
      "tool_name": "TestO 2.0",
      "tool_version": "2.0",
      "sha256": null,
      "contains_personal_data": false,
      "description": "Curated raw excerpt, source digest, and provenance for one read-only sequential CAS/DDE full-cycle acquisition; the complete raw trace remains outside Git."
    },
    {
      "evidence_id": "CURRENT_TEST_VEHICLE_PHASE3D_SGBD_START_CATALOG_2026_08_09",
      "kind": "MANUAL_NOTE",
      "relative_path": "current-test-vehicle-phase3d-sgbd-start-observation-catalog-2026-08-09.manual-note.txt",
      "captured_at": "2026-08-09T23:00:08+02:00",
      "tool_name": "TestO static SGBD export",
      "tool_version": "2.0",
      "sha256": null,
      "contains_personal_data": false,
      "description": "Provenance and SHA-256 digests for the local CAS/DDE static exports used to derive the read-only start-observation signal catalog; full exports remain outside Git."
    }
  ]
}
